Protein identifier	Contig id	Start	Stop	Strand	Gene symbol	Sequence name	Scope	Element type	Element subtype	Class	Subclass	Method	Target length	Reference sequence length	% Coverage of reference sequence	% Identity to reference sequence	Alignment length	Accession of closest sequence	Name of closest sequence	HMM id	HMM description
NA	Contig_10_59.119	1529	1906	-	blaI	penicillinase repressor BlaI	core	AMR	AMR	BETA-LACTAM	BETA-LACTAM	BLASTX	126	126	100.00	99.21	126	WP_001284656.1	penicillinase repressor BlaI	NA	NA
NA	Contig_10_59.119	1899	3653	-	blaR1	beta-lactam sensor/signal transducer BlaR1	core	AMR	AMR	BETA-LACTAM	BETA-LACTAM	BLASTX	585	585	100.00	95.56	585	WP_001096386.1	beta-lactam sensor/signal transducer BlaR1	NA	NA
NA	Contig_10_59.119	3760	4602	+	blaZ	penicillin-hydrolyzing class A beta-lactamase BlaZ	core	AMR	AMR	BETA-LACTAM	BETA-LACTAM	EXACTX	281	281	100.00	100.00	281	WP_000733289.1	penicillin-hydrolyzing class A beta-lactamase BlaZ	NA	NA
NA	Contig_10_59.119	16505	17119	+	cadD	cadmium resistance transporter CadD	plus	STRESS	METAL	CADMIUM	CADMIUM	BLASTX	205	205	100.00	99.51	205	BAB43874.1	cadmium resistance transporter CadD	NA	NA
NA	Contig_14_93.3256	10287	11261	-	mecR1	beta-lactam sensor/signal transducer MecR1	core	AMR	AMR	BETA-LACTAM	METHICILLIN	PARTIALX	325	585	55.56	100.00	325	WP_000952923.1	beta-lactam sensor/signal transducer MecR1	NA	NA
NA	Contig_14_93.3256	11361	13364	+	mecA	PBP2a family beta-lactam-resistant peptidoglycan transpeptidase MecA	core	AMR	AMR	BETA-LACTAM	METHICILLIN	EXACTX	668	668	100.00	100.00	668	WP_000721310.1	PBP2a family beta-lactam-resistant peptidoglycan transpeptidase MecA	NA	NA
NA	Contig_14_93.3256	98832	99881	-	icaC	polysaccharide intercellular adhesin biosynthesis/export protein IcaC	plus	VIRULENCE	VIRULENCE	NA	NA	BLASTX	350	350	100.00	99.71	350	AUU58561.1	polysaccharide intercellular adhesin biosynthesis/export protein IcaC	NA	NA
NA	Contig_14_93.3256	142523	144049	+	aur	zinc metalloproteinase aureolysin	plus	VIRULENCE	VIRULENCE	NA	NA	BLASTX	509	509	100.00	99.41	509	EHO93748.1	zinc metalloproteinase aureolysin	NA	NA
NA	Contig_15_67.8193	1109	2485	+	tet(K)	tetracycline efflux MFS transporter Tet(K)	core	AMR	AMR	TETRACYCLINE	TETRACYCLINE	BLASTX	459	459	100.00	99.78	459	WP_000492283.1	tetracycline efflux MFS transporter Tet(K)	NA	NA
NA	Contig_19_67.9141	327	1058	-	erm(C)	23S rRNA (adenine(2058)-N(6))-methyltransferase Erm(C)	core	AMR	AMR	LINCOSAMIDE/MACROLIDE/STREPTOGRAMIN	CLINDAMYCIN/ERYTHROMYCIN/STREPTOGRAMIN B/TYLOSIN	EXACTX	244	244	100.00	100.00	244	WP_001003263.1	23S rRNA (adenine(2058)-N(6))-methyltransferase Erm(C)	NA	NA
NA	Contig_1_83.565	76028	77002	-	hlgB	bi-component gamma-hemolysin HlgAB/HlgCB subunit B	plus	VIRULENCE	VIRULENCE	NA	NA	BLASTX	325	325	100.00	97.54	325	CAA57278.1	bi-component gamma-hemolysin HlgAB/HlgCB subunit B	NA	NA
NA	Contig_1_83.565	77007	77951	-	hlgC	bi-component gamma-hemolysin HlgCB subunit C	plus	VIRULENCE	VIRULENCE	NA	NA	BLASTX	315	315	100.00	97.46	315	CAA57277.1	bi-component gamma-hemolysin HlgCB subunit C	NA	NA
NA	Contig_1_83.565	78521	79447	-	hlgA	bi-component gamma-hemolysin HlgAB subunit A	plus	VIRULENCE	VIRULENCE	NA	NA	EXACTX	309	309	100.00	100.00	309	AUU54669.1	bi-component gamma-hemolysin HlgAB subunit A	NA	NA
NA	Contig_20_84.9559	1612	2517	+	ant(6)-Ia	aminoglycoside nucleotidyltransferase ANT(6)-Ia	core	AMR	AMR	AMINOGLYCOSIDE	STREPTOMYCIN	EXACTX	302	302	100.00	100.00	302	WP_001255866.1	aminoglycoside nucleotidyltransferase ANT(6)-Ia	NA	NA
NA	Contig_20_84.9559	2517	3056	+	sat4	streptothricin N-acetyltransferase Sat4	core	AMR	AMR	STREPTOTHRICIN	STREPTOTHRICIN	EXACTX	180	180	100.00	100.00	180	WP_000627290.1	streptothricin N-acetyltransferase Sat4	NA	NA
NA	Contig_20_84.9559	3152	3943	+	aph(3')-IIIa	aminoglycoside O-phosphotransferase APH(3')-IIIa	core	AMR	AMR	AMINOGLYCOSIDE	AMIKACIN/KANAMYCIN	EXACTX	264	264	100.00	100.00	264	WP_001096887.1	aminoglycoside O-phosphotransferase APH(3')-IIIa	NA	NA
NA	Contig_21_90.3048	8215	8937	+	seh	staphylococcal enterotoxin type H	plus	VIRULENCE	VIRULENCE	NA	NA	EXACTX	241	241	100.00	100.00	241	AAA19777.1	staphylococcal enterotoxin type H	NA	NA
NA	Contig_21_90.3048	75772	77121	+	tet(38)	tetracycline efflux MFS transporter Tet(38)	core	AMR	AMR	TETRACYCLINE	TETRACYCLINE	EXACTX	450	450	100.00	100.00	450	WP_001100294.1	tetracycline efflux MFS transporter Tet(38)	NA	NA
NA	Contig_21_90.3048	306037	307389	+	mepA	multidrug efflux MATE transporter MepA	plus	AMR	AMR	TETRACYCLINE	TIGECYCLINE	BLASTX	451	451	100.00	99.33	451	BAB41547.1	multidrug efflux MATE transporter MepA	NA	NA
NA	Contig_22_69.3885	29370	29447	+	hld	delta-hemolysin	plus	VIRULENCE	VIRULENCE	NA	NA	BLASTX	26	26	100.00	96.15	26	AGU62139.1	delta-hemolysin	NA	NA
NA	Contig_23_78.3304	113016	114455	+	lmrS	multidrug efflux MFS transporter LmrS	plus	STRESS	BIOCIDE	MACROLIDE/PHENICOL	CHLORAMPHENICOL/ERYTHROMYCIN	BLASTX	480	480	100.00	99.38	480	AAW38464.1	multidrug efflux MFS transporter LmrS	NA	NA
NA	Contig_4_70.4064	516340	517632	+	pbp4_R200L	Staphylococcus aureus cephalosporin resistant Pbp4	core	AMR	POINT	BETA-LACTAM	CEPHALOSPORIN	POINTX	431	431	100.00	98.84	431	WP_123090655.1	D-alanyl-D-alanine carboxypeptidase	NA	NA
NA	Contig_9_65.7847	3716	4435	-	splB	serine protease SplB	plus	VIRULENCE	VIRULENCE	NA	NA	BLASTX	240	240	100.00	99.58	240	ABD31003.1	serine protease SplB	NA	NA
NA	Contig_9_65.7847	4563	5267	-	splA	serine protease SplA	plus	VIRULENCE	VIRULENCE	NA	NA	BLASTX	235	235	100.00	99.57	235	ABD31004.1	serine protease SplA	NA	NA
NA	Contig_9_65.7847	16919	17899	-	lukD	bi-component leukocidin LukED subunit D	plus	VIRULENCE	VIRULENCE	NA	NA	BLASTX	327	327	100.00	94.50	327	CAA73668.1	bi-component leukocidin LukED subunit D	NA	NA
NA	Contig_9_65.7847	17904	18836	-	lukE	bi-component leukocidin LukED subunit E	plus	VIRULENCE	VIRULENCE	NA	NA	BLASTX	311	311	100.00	99.68	311	RCV70079.1	bi-component leukocidin LukED subunit E	NA	NA
